{
  "$schema": "../schema.json",
  "schema_version": 1,
  "id": "main",
  "display_name": "Main modded 1.20.1",
  "gameplay": "modded",
  "minecraft_version": "1.20.1",
  "loader": {
    "type": "forge",
    "version": "47.4.10"
  },
  "compose_file": "compose.yaml",
  "mods": {
    "source": "extras/cf-mods.txt"
  }
}
