{
  "$schema": "../schema.json",
  "schema_version": 1,
  "id": "prominence",
  "display_name": "Prominence II: Hasturian Era 4.1.4",
  "gameplay": "modded",
  "minecraft_version": "1.20.1",
  "loader": { "type": "fabric", "version": "0.19.3" },
  "compose_file": "compose.yaml",
  "mods": {
    "source": "extras/curseforge-modpack.json",
    "resolver": "curseforge-modpack"
  }
}
